{"accepted_findings":["PI-IRREVERSIBLE-WEAK-EVIDENCE"],"assessment_sha256":"a29e47df1b511ae09416b631304f33971f44b0161f50dacec22de2b8e5d5ec4d","authorized_exceptions":[],"human_disposition":"HOLD_FOR_REVIEW","next_review_trigger":"New independent evidence or changed exact bytes.","public_release_decision":"SYNTHETIC_DEMONSTRATION_ONLY","rationale":"This fictional record demonstrates the control outcome without authorizing action.","rejected_findings":[],"review_basis":["Deterministic fictional fixture and exact-byte validation"],"review_time":"2026-08-08T04:00:00Z","reviewer_record":"Synthetic Human Reviewer","stop_condition":"Stop if assessment or validation bytes change.","unresolved_questions":["What additional evidence would change the bounded decision?"],"validation_sha256":"71b5b668720263cf575c4014ea8ee582e305906c3c97885ed8c8d2db20bd91eb"}
